{
  "catalog_version": 1,
  "source": "MITRE ATT&CK for ICS",
  "attack_version": "19.2",
  "attack_release_date": "2026-08-05",
  "source_url": "https://raw.githubusercontent.com/mitre-attack/attack-stix-data/master/ics-attack/ics-attack.json",
  "tactics": [
    {
      "id": "TA0100",
      "name": "Collection",
      "shortname": "collection"
    },
    {
      "id": "TA0101",
      "name": "Command and Control",
      "shortname": "command-and-control"
    },
    {
      "id": "TA0102",
      "name": "Discovery",
      "shortname": "discovery"
    },
    {
      "id": "TA0103",
      "name": "Evasion",
      "shortname": "evasion"
    },
    {
      "id": "TA0104",
      "name": "Execution",
      "shortname": "execution"
    },
    {
      "id": "TA0105",
      "name": "Impact",
      "shortname": "impact"
    },
    {
      "id": "TA0106",
      "name": "Impair Process Control",
      "shortname": "impair-process-control"
    },
    {
      "id": "TA0107",
      "name": "Inhibit Response Function",
      "shortname": "inhibit-response-function"
    },
    {
      "id": "TA0108",
      "name": "Initial Access",
      "shortname": "initial-access"
    },
    {
      "id": "TA0109",
      "name": "Lateral Movement",
      "shortname": "lateral-movement"
    },
    {
      "id": "TA0110",
      "name": "Persistence",
      "shortname": "persistence"
    },
    {
      "id": "TA0111",
      "name": "Privilege Escalation",
      "shortname": "privilege-escalation"
    }
  ],
  "techniques": [
    {
      "id": "T0800",
      "name": "Activate Firmware Update Mode",
      "is_subtechnique": false,
      "tactics": [
        "TA0107"
      ],
      "url": "https://attack.mitre.org/techniques/T0800/"
    },
    {
      "id": "T0801",
      "name": "Monitor Process State",
      "is_subtechnique": false,
      "tactics": [
        "TA0100"
      ],
      "url": "https://attack.mitre.org/techniques/T0801/"
    },
    {
      "id": "T0802",
      "name": "Automated Collection",
      "is_subtechnique": false,
      "tactics": [
        "TA0100"
      ],
      "url": "https://attack.mitre.org/techniques/T0802/"
    },
    {
      "id": "T0806",
      "name": "Brute Force I/O",
      "is_subtechnique": false,
      "tactics": [
        "TA0106"
      ],
      "url": "https://attack.mitre.org/techniques/T0806/"
    },
    {
      "id": "T0807",
      "name": "Command-Line Interface",
      "is_subtechnique": false,
      "tactics": [
        "TA0104"
      ],
      "url": "https://attack.mitre.org/techniques/T0807/"
    },
    {
      "id": "T0809",
      "name": "Data Destruction",
      "is_subtechnique": false,
      "tactics": [
        "TA0107"
      ],
      "url": "https://attack.mitre.org/techniques/T0809/"
    },
    {
      "id": "T0811",
      "name": "Data from Information Repositories",
      "is_subtechnique": false,
      "tactics": [
        "TA0100"
      ],
      "url": "https://attack.mitre.org/techniques/T0811/"
    },
    {
      "id": "T0813",
      "name": "Denial of Control",
      "is_subtechnique": false,
      "tactics": [
        "TA0105"
      ],
      "url": "https://attack.mitre.org/techniques/T0813/"
    },
    {
      "id": "T0814",
      "name": "Denial of Service",
      "is_subtechnique": false,
      "tactics": [
        "TA0107"
      ],
      "url": "https://attack.mitre.org/techniques/T0814/"
    },
    {
      "id": "T0815",
      "name": "Denial of View",
      "is_subtechnique": false,
      "tactics": [
        "TA0105"
      ],
      "url": "https://attack.mitre.org/techniques/T0815/"
    },
    {
      "id": "T0816",
      "name": "Device Restart/Shutdown",
      "is_subtechnique": false,
      "tactics": [
        "TA0107"
      ],
      "url": "https://attack.mitre.org/techniques/T0816/"
    },
    {
      "id": "T0817",
      "name": "Drive-by Compromise",
      "is_subtechnique": false,
      "tactics": [
        "TA0108"
      ],
      "url": "https://attack.mitre.org/techniques/T0817/"
    },
    {
      "id": "T0819",
      "name": "Exploit Public-Facing Application",
      "is_subtechnique": false,
      "tactics": [
        "TA0108"
      ],
      "url": "https://attack.mitre.org/techniques/T0819/"
    },
    {
      "id": "T0820",
      "name": "Exploitation for Evasion",
      "is_subtechnique": false,
      "tactics": [
        "TA0103"
      ],
      "url": "https://attack.mitre.org/techniques/T0820/"
    },
    {
      "id": "T0821",
      "name": "Modify Controller Tasking",
      "is_subtechnique": false,
      "tactics": [
        "TA0104"
      ],
      "url": "https://attack.mitre.org/techniques/T0821/"
    },
    {
      "id": "T0822",
      "name": "External Remote Services",
      "is_subtechnique": false,
      "tactics": [
        "TA0108"
      ],
      "url": "https://attack.mitre.org/techniques/T0822/"
    },
    {
      "id": "T0823",
      "name": "Graphical User Interface",
      "is_subtechnique": false,
      "tactics": [
        "TA0104"
      ],
      "url": "https://attack.mitre.org/techniques/T0823/"
    },
    {
      "id": "T0826",
      "name": "Loss of Availability",
      "is_subtechnique": false,
      "tactics": [
        "TA0105"
      ],
      "url": "https://attack.mitre.org/techniques/T0826/"
    },
    {
      "id": "T0827",
      "name": "Loss of Control",
      "is_subtechnique": false,
      "tactics": [
        "TA0105"
      ],
      "url": "https://attack.mitre.org/techniques/T0827/"
    },
    {
      "id": "T0828",
      "name": "Loss of Productivity and Revenue",
      "is_subtechnique": false,
      "tactics": [
        "TA0105"
      ],
      "url": "https://attack.mitre.org/techniques/T0828/"
    },
    {
      "id": "T0829",
      "name": "Loss of View",
      "is_subtechnique": false,
      "tactics": [
        "TA0105"
      ],
      "url": "https://attack.mitre.org/techniques/T0829/"
    },
    {
      "id": "T0830",
      "name": "Adversary-in-the-Middle",
      "is_subtechnique": false,
      "tactics": [
        "TA0100"
      ],
      "url": "https://attack.mitre.org/techniques/T0830/"
    },
    {
      "id": "T0831",
      "name": "Manipulation of Control",
      "is_subtechnique": false,
      "tactics": [
        "TA0105"
      ],
      "url": "https://attack.mitre.org/techniques/T0831/"
    },
    {
      "id": "T0832",
      "name": "Manipulation of View",
      "is_subtechnique": false,
      "tactics": [
        "TA0105"
      ],
      "url": "https://attack.mitre.org/techniques/T0832/"
    },
    {
      "id": "T0834",
      "name": "Native API",
      "is_subtechnique": false,
      "tactics": [
        "TA0104"
      ],
      "url": "https://attack.mitre.org/techniques/T0834/"
    },
    {
      "id": "T0835",
      "name": "Manipulate I/O Image",
      "is_subtechnique": false,
      "tactics": [
        "TA0107"
      ],
      "url": "https://attack.mitre.org/techniques/T0835/"
    },
    {
      "id": "T0836",
      "name": "Modify Parameter",
      "is_subtechnique": false,
      "tactics": [
        "TA0106"
      ],
      "url": "https://attack.mitre.org/techniques/T0836/"
    },
    {
      "id": "T0837",
      "name": "Loss of Protection",
      "is_subtechnique": false,
      "tactics": [
        "TA0105"
      ],
      "url": "https://attack.mitre.org/techniques/T0837/"
    },
    {
      "id": "T0838",
      "name": "Modify Alarm Settings",
      "is_subtechnique": false,
      "tactics": [
        "TA0107"
      ],
      "url": "https://attack.mitre.org/techniques/T0838/"
    },
    {
      "id": "T0840",
      "name": "Network Connection Enumeration",
      "is_subtechnique": false,
      "tactics": [
        "TA0102"
      ],
      "url": "https://attack.mitre.org/techniques/T0840/"
    },
    {
      "id": "T0842",
      "name": "Network Sniffing",
      "is_subtechnique": false,
      "tactics": [
        "TA0102"
      ],
      "url": "https://attack.mitre.org/techniques/T0842/"
    },
    {
      "id": "T0843",
      "name": "Program Download",
      "is_subtechnique": false,
      "tactics": [
        "TA0109"
      ],
      "url": "https://attack.mitre.org/techniques/T0843/"
    },
    {
      "id": "T0843.001",
      "name": "Download All",
      "is_subtechnique": true,
      "tactics": [
        "TA0109"
      ],
      "url": "https://attack.mitre.org/techniques/T0843.001/"
    },
    {
      "id": "T0843.002",
      "name": "Online Edit",
      "is_subtechnique": true,
      "tactics": [
        "TA0109"
      ],
      "url": "https://attack.mitre.org/techniques/T0843.002/"
    },
    {
      "id": "T0843.003",
      "name": "Program Append",
      "is_subtechnique": true,
      "tactics": [
        "TA0109"
      ],
      "url": "https://attack.mitre.org/techniques/T0843.003/"
    },
    {
      "id": "T0845",
      "name": "Program Upload",
      "is_subtechnique": false,
      "tactics": [
        "TA0100"
      ],
      "url": "https://attack.mitre.org/techniques/T0845/"
    },
    {
      "id": "T0846",
      "name": "Remote System Discovery",
      "is_subtechnique": false,
      "tactics": [
        "TA0102"
      ],
      "url": "https://attack.mitre.org/techniques/T0846/"
    },
    {
      "id": "T0846.001",
      "name": "Port Scan",
      "is_subtechnique": true,
      "tactics": [
        "TA0102"
      ],
      "url": "https://attack.mitre.org/techniques/T0846.001/"
    },
    {
      "id": "T0846.002",
      "name": "Broadcast Discovery",
      "is_subtechnique": true,
      "tactics": [
        "TA0102"
      ],
      "url": "https://attack.mitre.org/techniques/T0846.002/"
    },
    {
      "id": "T0846.003",
      "name": "Multicast Discovery",
      "is_subtechnique": true,
      "tactics": [
        "TA0102"
      ],
      "url": "https://attack.mitre.org/techniques/T0846.003/"
    },
    {
      "id": "T0847",
      "name": "Replication Through Removable Media",
      "is_subtechnique": false,
      "tactics": [
        "TA0108"
      ],